index,published,topic,term,domain,language,valid,de,title,description,en,la,url,image,archive,content,quote,added,feed,country,ipcc,continent
f3d9076d44ccb3920477669060e9512b,2026-07-01T04:45:30Z,Precipitation,furtună,www.mediafax.ro,ro,0.9,Chaos in Bukarest nach dem Sturm: Über 1.000 Feuerwehreinsätze in den letzten Stunden / U-Bahn-Station Piața Victoriei 2 geschlossen / Feuerwehrleute schwammen zu einem Einsatz in Sektor 1. Feuerwehrleute im Raum Bukarest-Ilfov hatten in den letzten 24 Stunden infolge des Sturms 1.000 Einsätze. Außerdem bereiten sie sich auf weitere 950 Einsätze vor. Einsätze gibt es auch in anderen Teilen des Landes. Eine Person starb während des Sturms und…,"Haos în București după furtună: Peste 1.000 de intervenții ale pompierilor în ultimele ore / Stația de metrou Piața Victoriei 2, închisă / Pompierii au înotat la o intervenție în Sectorul 1","Pompierii din zona București-Ilfov au avut 1.000 de misiuni în ultimele 24 de ore ca urmare a furtunii de marți. De asemenea, ei se pregătesc pentru alte 950 de intervenții. Operațiuni sunt și în alte zone ale țării. O persoană a murit în timpul furtunii, iar…","Chaos in Bucharest after the storm: Over 1,000 interventions by firefighters in the last hours / Piața Victoriei 2 metro station, closed / Firefighters swam to an intervention in Sector 1. Firefighters in the Bucharest-Ilfov area had 1,000 missions in the last 24 hours as a result of Tuesday's storm. They are also preparing for another 950 interventions. Operations are also in other areas of the country. One person died during the storm, and…","Chaos in Bucharest post tempestatem: Plus 1,000 interventus ab ignitoribus in ultimis horis / Piața Victoriei 2 statione metro clausa / Firefighters ad interveniendum in Sector natavit 1. Firefighters in area Bucharest-Ilfov 1000 missiones proximis 24 horis propter tempestatem Martis habuit. Etiam ad alium 950 interventus parant. Operationes etiam in aliis regionibus sunt. Unus homo in tempestate mortuus est, et…",https://www.mediafax.ro/social/haos-in-bucuresti-dupa-furtuna-peste-1-000-de-interventii-ale-pompierilor-in-ultimele-ore-statia-de-metrou-piata-victoriei-2-inchisa-pompierii-au-inotat-la-o-interventie-din-sectorul-1-23764497,https://www.mediafax.ro/wp-content/uploads/2026/07/furtuna.jpeg,,"O important staie de metrou, închis dup ce a fost inundat
Ploile abundente din cursul nopii de mari spre miercuri afecteaz circulaia metrourilor din Capital. În urma infiltraiilor, o important staie… [+2847 chars]",,2026-07-12 16:31:08+00:00,random,,,
47e3b37060230eeb8d87825c93611aa8,2026-07-01T05:16:52Z,Precipitation,furtună,adevarul.ro,ro,0.9,"Piața Victoriei 2, nach dem Sturm überflutet: Das Wasser erreichte die Plattform. Bei Dutzenden STB-Leitungen kommt es zu Verzögerungen oder Blockaden. Die heftigen Regenfälle, die Bukarest in der Nacht von Dienstag auf Mittwoch heimsuchten, führten zu erheblichen Blockaden im öffentlichen Nahverkehr.","Piața Victoriei 2, inundată după furtună: apa a ajuns până la peron. Zeci de linii STB înregistrează întârzieri sau blocaje",Ploile torențiale care au lovit Bucureștiul în noaptea de marți spre miercuri au provocat blocaje majore în transportul public.,"Piața Victoriei 2, flooded after the storm: the water reached the platform. Dozens of STB lines are experiencing delays or blockages. The torrential rains that hit Bucharest in the night from Tuesday to Wednesday caused major blockages in public transport.","Piața Victoriei II, post tempestatem inundata: aqua pervenit in suggestum. Dozens of STB lines experiuntur moras vel impedimenta. Imbres torrentes qui Bucharest noctu a die Martis ad Mercurii diem Martis maiorem impedimenta in publico onerario percusserunt effecit.",https://adevarul.ro/stiri-locale/bucuresti/piata-victoriei-2-sub-ape-dupa-furtuna-apa-a-2540142.html,https://cdn.adh.reperio.news/image-0/0be31013-0b39-4724-b284-d1fd593972ab/index.png?p=f%3Djpeg%26w%3D1200%26h%3D630%26r%3Dcover,,"Ploile toreniale care au lovit Bucuretiul în noaptea de mari spre miercuri au provocat blocaje majore în transportul public. Zeci de linii STB înregistreaz întârzieri, blocaje sau circul pe trasee mo… [+2287 chars]",,2026-07-12 16:31:08+00:00,random,,,
7315bec15ac81bec64de65aaf8281de2,2026-07-01T08:11:25Z,Thunderstorm,furtună,www.digi24.ro,ro,0.9,"IGSU-Empfehlungen nach den neuen Sturmwarnungen der ANM. Die Generalinspektion für Notsituationen sandte am Mittwoch Empfehlungen an die Bevölkerung, nachdem die Nationale Meteorologische Behörde neue Warnungen vor erhöhter atmosphärischer Instabilität herausgegeben hatte.",Recomandările IGSU după noile alerte de furtună emise de ANM,"Inspectoratul General pentru Situații de Urgență a transmis miercuri recomandări pentru populație, după noile avertizări de instabilitate atmosferică accentuată emise de Administrația Națională de Meteorologie.","IGSU recommendations after the new storm alerts issued by ANM. The General Inspectorate for Emergency Situations sent recommendations for the population on Wednesday, after the new warnings of heightened atmospheric instability issued by the National Meteorological Administration.","IGSU monita nova post erecta tempestate edita ab ANM. Inspector Generalis de condicionibus tumultuariis commendationes hominum die Mercurii misit, postquam novae admonitiones auctae instabilitatis atmosphaeriae Nationalis Meteorologicae Administrationis editae sunt.",https://www.digi24.ro/stiri/actualitate/recomandarile-igsu-dupa-noile-alerte-de-furtuna-emise-de-anm-3842091,https://s.iw.ro/gateway/g/ZmlsZVNvdXJjZT1odHRwJTNBJTJGJTJG/c3RvcmFnZTA4dHJhbnNjb2Rlci5yY3Mt/cmRzLnJvJTJGc3RvcmFnZSUyRjIwMjYl/MkYwNyUyRjAxJTJGMjgxNTc1Ml8yODE1/NzUyX0lOU1RBTlRfVVJNQVJJX0NPRF9S/T1NVXzA0X0lOUVVBTV9QaG90b3NfT2N0/YXZfR2FuZWEuanBnJnc9MTIwMCZoPTYz/MCZ6Yz0xJmhhc2g9Y2E3Nzc1MmUzZjY2ZTk1MzcyM2M0MTcwODViYWIzNjk=.thumb.jpg,,"Inspectoratul General pentru Situaii de Urgen a transmis miercuri recomandri pentru populaie, dup noile avertizri de instabilitate atmosferic accentuat emise de Administraia Naional de Meteorologie.… [+1242 chars]",,2026-07-12 16:31:08+00:00,random,,,
fd35b7073083b6852fef3141766ca656,2026-07-01T12:46:40Z,Thunderstorm,furtună,www.digi24.ro,ro,0.9,"Feuer in der U-Bahn nach dem Sturm: U-Bahn-Station Universitate, gesperrt. Die Passagiere wurden evakuiert. Ein am Mittwoch in der U-Bahn-Station Universitate ausgebrochener Brand führte zu Verkehrsbehinderungen und zur Evakuierung von Passagieren, nachdem eine Isolierung vor dem Hintergrund des Eindringens von Wasser und erhöhter Luftfeuchtigkeit nach dem heftigen Sturm, der die Hauptstadt heimgesucht hatte, Feuer fing.","Incendiu la metrou după furtună: stația Universitate, blocată. Călătorii au fost evacuați","Un incendiu izbucnit miercuri în stația de metrou Universitate a provocat blocarea circulației și evacuarea călătorilor, după ce un izolator a luat foc pe fondul infiltrațiilor de apă și al umidității crescute, în urma furtunii violente care a afectat Capital…","Fire on the subway after the storm: Universitate station, blocked. The passengers were evacuated. A fire that broke out on Wednesday in the Universitate metro station caused the blocking of traffic and the evacuation of passengers, after an insulator caught fire against the background of water infiltration and increased humidity, following the violent storm that affected the Capital…","Ignis in hamaxosticho post tempestatem: Universitas stationis obsessa est. Vectores excesserant. Ignis die Mercurii in statione metrorum Universitatis orta interclusio negotiationis et viatorum evacuatio effecit, postquam insulator ignem in curriculo aquae infiltration comprehendit et humiditatem augebat, sequens tempestas vehementia Capital…",https://www.digi24.ro/stiri/actualitate/incendiu-la-metrou-dupa-furtuna-statia-universitate-blocata-calatorii-au-fost-evacuati-3842877,https://s.iw.ro/gateway/g/ZmlsZVNvdXJjZT1odHRwJTNBJTJGJTJG/c3RvcmFnZTA4dHJhbnNjb2Rlci5yY3Mt/cmRzLnJvJTJGc3RvcmFnZSUyRjIwMjYl/MkYwNCUyRjA4JTJGMjY3Nzg0NV8yNjc3/ODQ1X2NhbGF0b3JpLW1ldHJvdS1mb3Rv/LW1ldHJvcmV4LTEuanBnJnc9MTIwMCZo/PTYzMCZ6Yz0xJmhhc2g9MGU3YWU0MTQ2NTUxMzY2NDNiZDdhOTdlNTVjNzk5NjY=.thumb.jpg,,"Un incendiu izbucnit miercuri în staia de metrou Universitate a provocat blocarea circulaiei i evacuarea cltorilor, dup ce un izolator a luat foc pe fondul infiltraiilor de ap i al umiditii crescute,… [+725 chars]",,2026-07-12 16:31:08+00:00,random,,,
cdb04fcaebeff18cedca5dd05d17049f,2026-07-01T14:33:58Z,Precipitation,furtună,www.biziday.ro,ro,0.9,"Sofortige Code-Rote Sturmwarnung in Ilfov, für die Gebiete Găneasa, Grădiștea, Petrăchioaia, Dascălu, in der nächsten Stunde. Meteorologen kündigen sintflutartige Regenfälle, Windgeschwindigkeiten von 90 km/h und Hagel an. Die Nationale Meteorologische Behörde hat für die Ortschaften Găneasa, Grădiștea, Petrăchioaia und Dascălu eine Warnmeldung „Now Casting Code Red“ herausgegeben, die zwischen 17:35 und 18:20 Uhr gültig ist. Es werden starke Stürme mit Windgeschwindigkeiten von über 90 km/h erwartet.","Avertizare imediată Cod Roșu de furtună în Ilfov, pentru zonele Găneasa, Grădiștea, Petrăchioaia, Dascălu, în următoarea oră. Meteorologii anunță ploi torențiale, vânt de 90 km/h și grindină.","Administrația Națională de Meteorologie a emis o avertizare Now Casting Cod Roșu valabilă în intervalul 17:35-18:20, pentru localitățile Găneasa, Grădiștea, Petrăchioaia și Dascălu. Sunt așteptate vijelie puternică, cu viteze ale vântului de peste 90 km/h la …","Immediate Code Red storm warning in Ilfov, for the areas of Găneasa, Grădiștea, Petrăchioaia, Dascălu, in the next hour. Meteorologists announce torrential rains, wind of 90 km/h and hail.. The National Meteorological Administration has issued a Now Casting Code Red warning valid between 17:35-18:20, for the localities of Găneasa, Grădiștea, Petrăchioaia and Dascălu. Strong gales are expected, with wind speeds of over 90 km/h at …","Immediatus Codex Red tempestas observavit in Ilfov, in locis Ganeasae, Graditea, Petrachioaia, Dascaliae, in hora altera. Meteorologi nuntiant imbres torrentes, ventum 90 km/h et grando.. Nationali Meteorologico Administrationis edita nunc Codicis Rubri admonitionem fundens valida inter 17:35-18:20, pro locis Găneasa, Gradiștea, Petrăchioaia et Dascălu. Fortis aurae exspectantur, cum velocitates ventorum super 90 km/h in ...",https://www.biziday.ro/362450-2/,,,"Administraia Naional de Meteorologie a emis o avertizare Now Casting Cod Rou valabil în intervalul 17:35-18:20, pentru localitile Gneasa, Grditea, Petrchioaia i Dasclu.
Sunt ateptate vijelie puterni… [+407 chars]",,2026-07-12 16:31:08+00:00,random,,,
d6aa3247e3c80e8b80e9c05412558821,2026-07-01T15:06:07Z,Thunderstorm,furtună,adevarul.ro,ro,0.9,"Bukarest wird erneut von Unwettern heimgesucht. Roter Code für sintflutartige Regenfälle in mehreren Landkreisen. Die Nationale Meteorologische Verwaltung (ANM) gab am Mittwoch, dem 1. Juli, drei Sturmwarnungen des Codes Rot für Bukarest und den Kreis Ilfov sowie eine Warnung des Codes Orange für die Kreise Constanța und Tulcea heraus. In den Zielgebieten wurden übertragen...","Bucureștiul, vizat din nou de furtuni. Cod roșu de ploi torențiale în mai multe județe","Administrația Națională de Meteorologie (ANM) a emis miercuri, 1 iulie, trei avertizări de Cod roșu de furtună pentru București și județul Ilfov, precum și o avertizare de Cod portocaliu pentru județele Constanța și Tulcea. În zonele vizate au fost transmise …","Bucharest, targeted again by storms. Red code of torrential rain in several counties. The National Meteorological Administration (ANM) issued on Wednesday, July 1, three Code Red storm warnings for Bucharest and Ilfov county, as well as a Code Orange warning for Constanța and Tulcea counties. In the targeted areas were transmitted...","Bucharest, iterum procellis iaculis. Red codice imbres torrentiales in pluribus comitatibus. Administratio Meteorologica Nationalis (ANM) die Mercurii, I Iulii, tres Codicis Rubei monita tempestatis pro Comitatu Bucharesti et Ilfov edita, necnon Codex Aureus monitus pro Comitatibus Constanța et Tulcea. In iaculis elit vitae cursus.",https://adevarul.ro/stiri-interne/meteo/bucurestiul-vizat-din-nou-de-furtuni-cod-rosu-de-2540336.html,https://cdn.adh.reperio.news/image-c/c4d4f7df-81df-48c1-af7b-0a75234681b8/index.jpeg?p=f%3Djpeg%26w%3D1200%26h%3D630%26r%3Dcover,,"Administraia Naional de Meteorologie (ANM) a emis miercuri, 1 iulie, trei avertizri de Cod rou de furtun pentru Bucureti i judeele Ilfov i Ialomia, precum i o avertizare de Cod portocaliu pentru jude… [+2630 chars]",,2026-07-12 16:31:08+00:00,random,,,
13f6114884410de1f137660747e88712,2026-07-02T08:02:49Z,Thunderstorm,grindină,www.biziday.ro,ro,0.9,"Für das ganze Land gilt bis Samstagmorgen Sturmwarnung mit mengenmäßig erheblichem Regen, Windgeschwindigkeiten zwischen 70-100 km/h und kleinem und mittlerem Hagel. Code Orange in den meisten Regionen. Die National Meteorological Administration (ANM) hat eine Warnung vor instabilem Wetter herausgegeben, die von heute bis Freitag um 03.00 Uhr gültig ist. Zwei Codes sind in Kraft getreten, einer in Orange und einer in Gelb, und Meteorologen warnen, dass in mehreren Regionen des Landes...","Toată țara intră până sâmbătă dimineață sub avertizări de furtună, cu ploi însemnate cantitativ, vânt cu viteze între 70 – 100 km/h și grindină de dimensiuni mici și medii. Cod Portocaliu în majoritatea regiunilor.","Administrația Națională de Meteorologie (ANM) a emis o avertizare de vreme instabilă, valabilă de astăzi până vineri, ora 03.00. Au intrat în vigoare două coduri, unul portocaliu și unul galben, iar meteorologii avertizează că în mai multe regiuni ale țării s…","The whole country goes under storm warnings until Saturday morning, with quantitatively significant rain, wind speeds between 70-100 km/h and small and medium-sized hail. Code Orange in most regions.. The National Meteorological Administration (ANM) has issued an unstable weather warning, valid from today until Friday at 03.00. Two codes have entered into force, one orange and one yellow, and meteorologists warn that in several regions of the country...","Tota terra monitis tempestatis usque ad mane Sabbati it, cum pluvia quantitatis significantibus, celeritatibus ventorum inter 70-100 km/h et grandinem parvum et mediocrem. Codex Orange in plerisque regionibus. Administratio Meteorologica Nationalis (ANM) tempestatem instabilem admonitionem edidit, valida ab hodierno die usque ad diem Veneris 03.00. Duo codices vim inierunt, unus aurantiacus et unus flavus, et astrologi monent in pluribus regionibus regionis...",https://www.biziday.ro/362525-2/,https://cdn.biziday.ro/wp-content/uploads/2026/07/Harta-1-cod-portocaliu.jpeg,,"Administraia Naional de Meteorologie (ANM) a emis o avertizare de vreme instabil, valabil de astzi pân vineri, ora 03.00. Au intrat în vigoare dou coduri, unul portocaliu i unul galben, iar meteorolo… [+2045 chars]",,2026-07-12 16:31:08+00:00,random,,,
2f46094367a3126d35b36f09d94f0ee8,2026-07-02T16:28:35Z,Thunderstorm,furtună,www.biziday.ro,ro,0.9,"Suceava-Sofortcode Warnung vor einem roten Sturm für die Gebiete Campulung Moldovenesc, Moldovița, Putna, Vatra Moldoviței und zahlreiche andere Orte im Kreis. Mindestens bis 20:00 Uhr gibt es starken Regen und Blitze. Nach den Regenfällen der letzten Stunden haben sich bereits über 50 l/m2 angesammelt. Die National Meteorological Administration (ANM) hat für mehrere Orte im Kreis Suceava eine Sturmwarnung mit dem Code Red herausgegeben. Die Warnung gilt bis mindestens 20 Uhr. Meteorologen kündigen sintflutartige Schauer an, die sich lokal über 25–30 Jahre ansammeln werden.","Suceava. Avertizare imediată Cod Roșu de furtună, pentru zonele Câmpulung Moldovenesc, Moldovița, Putna, Vatra Moldoviței și numeroase alte localități din județ. Cel puțin până la ora 20, va ploua torențial și vor fi descărcări electrice. În urma ploilor din ultimele ore, deja s-au acumulat peste 50 l/mp.",Administrația Națională de Meteorologie (ANM) a emis o avertizare Cod Roșu de furtună pentru mai multe localități din județul Suceava. Avertizarea este valabilă până la cel puțin ora 20. Meteorologii anunță averse torențiale care vor acumula local peste 25-30…,"Suceava Immediate Code Red storm warning for the areas of Campulung Moldovenesc, Moldovița, Putna, Vatra Moldoviței and numerous other localities in the county. At least until 20:00, there will be heavy rain and lightning. Following the rains of the last few hours, more than 50 l/m2 have already accumulated. The National Meteorological Administration (ANM) has issued a Code Red storm warning for several localities in Suceava county. The warning is valid until at least 8 p.m. Meteorologists announce torrential showers that will accumulate locally over 25-30...","Suceava Immediatus Codex Rubeus tempestate monitus pro locis Campulung Moldovenesc, Moldovița, Putna, Vatra Moldoviței et alia multa in com. Saltem usque ad 20:00, erit pluvia et fulgur. Post imbres ultimarum paucarum horarum plus quam 50 l/m2 iam congestae sunt. Administratio Meteorologica Nationalis (ANM) Codicis Rubri admonitio aliquot locorum in Comitatu Suceava edidit. Cautio valet usque ad minimum VIII a.m. Meteorologistae denuntiant imbres torrentes qui localiter super 25-30 ... accumulabunt",https://www.biziday.ro/362571-2/,,,Administraia Naional de Meteorologie (ANM) a emis o avertizare Cod Rou de furtun pentru mai multe localiti din judeul Suceava. Avertizarea este valabil pân la cel puin ora 20. Meteorologii anun avers… [+816 chars],,2026-07-12 16:31:08+00:00,random,,,
4a98f1e5656a93658663af564e15a2e0,2026-07-02T16:38:52Z,Precipitation,furtună,www.biziday.ro,ro,0.9,"Maramureș. Sofortige Code-Rote-Sturmwarnung für die Gebiete Borșa, Vișeu de Sus, Repedea und viele andere Orte im Kreis. Mindestens bis 20:40 Uhr wird es heftig regnen und blitzen. Nach den Regenfällen der letzten Stunden haben sich bereits über 50 l/m2 angesammelt. Die Nationale Meteorologische Verwaltung (ANM) hat für mehrere Orte im Kreis Maramureș eine Sturmwarnung des Code-Rot-Codes herausgegeben, die bis mindestens 20:40 Uhr gültig ist. Meteorologen kündigen sintflutartige Regenfälle an, die sich lokal mit über 25 l/m2 ansammeln und...","Maramureș. Avertizare imediată Cod Roșu de furtună, pentru zonele Borșa, Vișeu de Sus, Repedea și numeroase alte localități din județ. Cel puțin până la ora 20:40, va ploua torențial și vor fi descărcări electrice. În urma ploilor din ultimele ore, deja s-au acumulat peste 50 l/mp.","Administrația Națională de Meteorologie (ANM) a emis o avertizare Cod Roșu de furtună pentru mai multe localități din județul Maramureș, valabilă până cel puțin la ora 20:40. Meteorologii anunță averse torențiale care vor acumula local peste 25 l/mp și vor fi…","Maramureș. Immediate Code Red storm warning for the areas of Borșa, Vișeu de Sus, Repedea and many other localities in the county. At least until 20:40, there will be heavy rain and lightning. Following the rains of the last few hours, more than 50 l/m2 have already accumulated. The National Meteorological Administration (ANM) has issued a Code Red storm warning for several localities in Maramureș county, valid until at least 8:40 p.m. Meteorologists announce torrential downpours that will accumulate locally over 25 l/m2 and will be...","Maramure. Immediatus Codex Rubeus tempestas observavit regiones Borșa, Vișeu de Sus, Repedea et multae aliae in comitatu locali. Saltem usque ad 20:40, erit pluvia et fulgur. Post imbres ultimarum paucarum horarum plus quam 50 l/m2 iam congestae sunt. Administratio Meteorologica Nationalis (ANM) Codicem Red tempestatem monitum pro pluribus locis in comitatu Maramure edidit, validum usque ad minimum 8:40 a.m. Meteorologi nuntiant imbres torrentes qui locum super 25 l/m2 coacervabunt et erunt...",https://www.biziday.ro/362575-2/,,,"Administraia Naional de Meteorologie (ANM) a emis o avertizare Cod Rou de furtun pentru mai multe localiti din judeul Maramure, valabil pân cel puin la ora 20:40. 
Meteorologii anun averse toreniale… [+596 chars]",,2026-07-12 16:31:08+00:00,random,,,
66c0bdf7c2b055005163bbf2c1002f21,2026-07-03T10:27:43Z,Snow&Ice,ger,adevarul.ro,ro,0.9,"Was tun, wenn Sie in ein Gewitter geraten: Die Regeln, die Ihr Leben retten können. In Rumänien wird vor sintflutartigen Regenfällen, Stürmen und elektrischen Entladungen gewarnt, und Experten machen darauf aufmerksam, dass eine scheinbar triviale Geste, wie etwa das Unterschlupfen unter einem Baum, tödlich sein kann.",Ce să faci dacă ești surprins de o furtună cu fulgere și trăsnete: regulile care îți pot salva viața,"România se află sub avertizări de ploi torențiale, vijelii și descărcări electrice, iar specialiștii atrag atenția că un gest aparent banal, precum adăpostirea sub un copac, poate deveni fatal.","What to do if you are caught in a lightning storm: the rules that can save your life. Romania is under warnings of torrential rains, storms and electrical discharges, and specialists draw attention to the fact that a seemingly trivial gesture, such as sheltering under a tree, can become fatal.","Quid faciam, si te tempestate fulmine deprensum: praecepta, quae possunt animam servare tuam. Romania monitis imbribus, procellis et electricis obit, et magistri animum intendunt quod quasi levis gestus, ut sub arbore obumbrans, mortifera fieri potest.",https://adevarul.ro/stiri-interne/societate/ce-sa-faci-daca-esti-surprins-de-o-furtuna-cu-2540789.html,https://cdn.adh.reperio.news/image-c/c2cfcd5c-a92d-404f-840a-f11ada80d86b/index.jpeg?p=f%3Djpeg%26w%3D1200%26h%3D630%26r%3Dcover,,"România se afl sub avertizri de ploi toreniale, vijelii i descrcri electrice, iar specialitii atrag atenia c un gest aparent banal, precum adpostirea sub un copac, poate deveni fatal. Medicul Tudor C… [+4264 chars]",,2026-07-12 16:31:08+00:00,random,,,
a13386b3c59f902d8ea2bfa9b7409240,2026-07-07T05:06:49Z,Heat Wave,val de căldură,www.realitatea.net,ro,0.9,"Riesige Hitzewelle im pazifischen Meer. Das Phänomen, das das Wetter auf der Welt in den kommenden Monaten verändern kann. Eine gewaltige Meereshitzewelle fegt über den Pazifischen Ozean und bedeckt eine Fläche, die mehr als achtmal so groß ist wie das Festland der Vereinigten Staaten. Das Phänomen ist so weitreichend, dass es das Wetter in mehreren Regionen der Welt beeinflussen könnte...",Val uriaș de căldură marină în Pacific. Fenomenul care poate schimba vremea în lume în următoarele luni,Un val masiv de căldură marină se întinde de-a lungul Oceanului Pacific și acoperă o suprafață de peste opt ori mai mare decât cea a Statelor Unite continentale. Fenomenul este atât de extins încât ar putea influența vremea din mai multe regiuni ale lumii în …,Huge Pacific Marine Heat Wave. The phenomenon that can change the weather in the world in the coming months. A massive marine heat wave is sweeping across the Pacific Ocean and covers an area more than eight times the size of the continental United States. The phenomenon is so extensive that it could influence the weather in several regions of the world in...,"Ingens Pacific Marine Caloris unda. Res, quae in mundo futurorum mensium tempestatem mutare potest. Ingens aestus marinus trans Oceanum Pacificum verrit et aream plus quam octies magnitudinem Americae continentalis operit. Res tam ampla est ut tempestatem in pluribus mundi regionibus influere possit.",https://www.realitatea.net/stiri/actualitate/val-urias-de-caldura-marina-in-pacific-fenomenul-care-poate-schimba-vremea-in-lume-in-urmatoarele-luni-ltvdpv,https://www.realitatea.net/storage/media/5/2025/07/ploaie-poza-buna-furtuna-cu-fulgere_05bd7f2059.webp,,Un val masiv de cldur marin se întinde de-a lungul Oceanului Pacific i acoper o suprafa de peste opt ori mai mare decât cea a Statelor Unite continentale. Fenomenul este atât de extins încât ar putea… [+8231 chars],,2026-07-13 04:11:53+00:00,random,,,
