index,published,topic,term,domain,language,valid,de,title,description,en,la,url,image,archive,content,quote,added,feed,country,ipcc,continent
b8cdda063ee91fec08ee747892d70990,2026-07-10T10:13:58Z,Landslide,alunecare de teren,www.realitatea.net,ro,0.9,"Fünf Tote auf den Philippinen und über 1.000 Evakuierte: Taiwan bereitet sich auf den Taifun Bavi vor. Fünf Menschen kamen bei einem Erdrutsch auf den Philippinen ums Leben, während in Taiwan mehr als 1.000 Menschen aus ihren Häusern vertrieben wurden und Schulen und öffentliche Einrichtungen geschlossen blieben, während sich der stärkste Taifun der letzten Zeit näherte …",Cinci morți în Filipine și peste 1.000 de evacuați: Taiwanul se blindează în fața taifunului Bavi,"Cinci oameni şi-au pierdut viaţa într-o alunecare de teren în Filipine, în timp ce în Taiwan peste 1.000 de persoane au fost mutate din locuinţe, iar şcolile şi instituţiile publice au rămas închise, pe fondul apropierii celui mai puternic taifun din ultimele…","Five dead in the Philippines and over 1,000 evacuated: Taiwan braces itself for typhoon Bavi. Five people lost their lives in a landslide in the Philippines, while in Taiwan more than 1,000 people were displaced from their homes and schools and public institutions remained closed, amid the approach of the strongest typhoon in recent…","Quinque mortui in Philippinis et plus mille excesserunt: Taiwan se adstringit pro typhonibus Bavi. Quinque homines in lapsibus Philippinis vitam amiserunt, cum in Taiwan plus mille homines e sedibus et scholis et institutis publicis abiectis clausa manserunt, inter accessionem fortissimi typhonis recentioris…",https://www.realitatea.net/stiri/actualitate/cinci-morti-in-filipine-si-peste-1000-de-evacuati-taiwanul-se-blindeaza-in-fata-taifunului-bavi-cfegv9,https://www.realitatea.net/storage/media/7/2026/07/taifunul-bavi-foto-profimedia-R6p11q.webp,,"Cinci oameni i-au pierdut viaa într-o alunecare de teren în Filipine, în timp ce în Taiwan peste 1.000 de persoane au fost mutate din locuine, iar colile i instituiile publice au rmas închise, pe fon… [+3299 chars]",,2026-07-13 04:11:53+00:00,random,,,
8ef953cb35d3597ee35dcc4be2e35751,2026-07-10T07:30:42Z,Drought,uscăciune gabon,www.mediafax.ro,ro,0.3,"Der Taifun Bavi ist auf dem Weg nach Ostchina. Es könnte sogar Taiwan erreichen. Ein starker Taifun zog am Freitag auf Chinas Ostküste zu, der jüngste in einer Reihe tödlicher Stürme, die diese Woche in zwei anderen Regionen des Landes bereits 50 Todesopfer gefordert haben.",Taifunul Bavi se îndreaptă spre estul Chinei. Ar putea ajunge chiar și în Taiwan,"Un taifun puternic se îndrepta, vineri, spre coasta de est a Chinei, fiind cel mai recent dintr-o serie de furtuni mortale care au provocat deja 50 de victime în această săptămână în alte două regiuni ale țării.","Typhoon Bavi is heading towards eastern China. It could even reach Taiwan. A powerful typhoon was headed for China's east coast on Friday, the latest in a series of deadly storms that have already claimed 50 lives this week in two other regions of the country.","Typhoon Bavi versus orientem Sinas spectat. Posset etiam ad Taiwan pervenire. Typhon valida ob oram orientalem Sinarum die Veneris petita est, novissima in serie tempestatum funestorum quae iam 50 vitam hanc hebdomadam in duabus aliis regionibus regionis petiverunt.",https://www.mediafax.ro/externe/taifunul-bavi-se-indreapta-spre-estul-chinei-ar-putea-ajunge-chiar-si-in-taiwan-23769966,https://www.mediafax.ro/wp-content/uploads/2026/07/hepta_8963195-scaled.jpg,,"Taifunul Bavi, cu vânturi maxime susinute de 162 de kilometri pe or, urma iniial s treac la nord de Taiwan, aducând ploi toreniale pe insula cu o populaie de 23 de milioane de locuitori, începând de … [+2641 chars]",,2026-07-14 07:27:39+00:00,edo,Gabon,CAF,Africa
3260098c094c001d50284882d70b590d,2026-07-11T17:20:30Z,Snow Avalanche,avalanșă,adevarul.ro,ro,0.3,"Taifun Bavi trifft China, Japan und Taiwan. Über 2 Millionen Menschen evakuiert. Die chinesischen Behörden evakuierten am Samstag mehr als 1,8 Millionen Menschen, bevor der Taifun Bavi an der Ostküste des Landes landete, wo er voraussichtlich in der Nähe der Stadt Wenzhou landen wird.","Taifunul Bavi lovește China, Japonia și Taiwan. Peste 2 milioane de oameni, evacuați","Autoritățile chineze au evacuat sâmbătă peste 1,8 milioane de persoane înainte ca taifunul Bavi să ajungă pe coasta de est a țării, unde este așteptat să lovească în apropierea orașului Wenzhou.","Typhoon Bavi hits China, Japan and Taiwan. Over 2 million people, evacuated. Chinese authorities evacuated more than 1.8 million people on Saturday before Typhoon Bavi made landfall on the country's east coast, where it is expected to make landfall near the city of Wenzhou.","Typhoon Bavi Sinas, Iaponiam et Taiwan pervenit. Plus II decies centena millia hominum excesserunt. Auctoritates Sinenses plus quam 1.8 miliones hominum die Sabbati ante Typhoon Bavi cedentem in orae patriae orientalis cesserunt, ubi expectatur ruinam prope urbem Wenzhou facturum esse.",https://adevarul.ro/stiri-externe/china/taifunul-bavi-loveste-china-japonia-si-taiwan-2542560.html,https://cdn.adh.reperio.news/image-a/acbd6666-022d-4339-a844-2b05e5b1c854/index.png?p=f%3Djpeg%26w%3D1200%26h%3D630%26r%3Dcover,,"Autoritile chineze au evacuat sâmbt peste 1,8 milioane de persoane înainte ca taifunul Bavi s ajung pe coasta de est a rii, unde este ateptat s loveasc în apropierea oraului Wenzhou. Dei furtuna i-a … [+2636 chars]",,2026-07-14 07:27:39+00:00,random,,,
a607c39112e6f0b84f31dc95471cac79,2026-07-12T04:01:21Z,Flood,inundație tasmania iunie iulie 2016,www.biziday.ro,ro,0.3,"Keiner. Meteorologen schätzen, dass es ab Sonntag um 12 Uhr und bis nach Mitternacht zu Phasen atmosphärischer Instabilität in den Südkarpaten, lokal in den Ostkarpaten und im Banater Gebirge, im Südosten Olteniens, Munteniens und im Westen Moldawiens kommen wird.",,"Meteorologii estimează că, începând de duminică la ora 12 și până după miezul nopții, vor fi perioade cu instabilitate atmosferică în Carpații Meridionali, local în Carpații Orientali și în Munții Banatului, în sud-estul Olteniei, Munteniei și în vestul Moldo…","None. Meteorologists estimate that, starting Sunday at 12 o'clock and until after midnight, there will be periods of atmospheric instability in the Southern Carpathians, locally in the Eastern Carpathians and in the Banat Mountains, in the southeast of Oltenia, Muntenia and in the west of Moldavia...","Nulli. Meteorologi aestimant, a Dominica hora 12 et usque post mediam noctem incipientes instabilitatis atmosphaericis in Carpathiis meridionalibus, localiter in Carpathiis Orientalibus et in Monte Banat, in meridiem Olteniae, Munteniae et in occidente Moldaviae.",https://www.biziday.ro/363223-2/,https://cdn.biziday.ro/wp-content/uploads/2026/07/cod-galben.png,,"Meteorologii estimeaz c, începând de duminic la ora 12 i pân dup miezul nopii, vor fi perioade cu instabilitate atmosferic în Carpaii Meridionali, local în Carpaii Orientali i în Munii Banatului, în … [+809 chars]",,2026-07-14 07:27:39+00:00,aidr,Australia,SAU,Oceania
51752e44a57e075bcac2a53efb0f7a8f,2026-07-02T11:21:10Z,Storm,furtuna,www.digi24.ro,ro,0.7,"Der Sturm, der Rumänien verwüstete, verursachte auch in Polen massive Schäden. Die Bilanz Warschaus nach den heftigen Wetterereignissen. Rekordtemperaturen in Polen führten am Mittwoch zu heftigen Stürmen, die die Rettungsdienste im ganzen Land belasteten. Die nationale Feuerwehr reagierte auf rund 3.000 Anrufe, da starker Wind…",Furtuna care a făcut ravagii în România a provocat pagube masive și în Polonia. Bilanțul Varșoviei după evenimentele meteo violente,"Temperaturile record înregistrate în Polonia au făcut loc unor furtuni violente miercuri, punând la grea încercare serviciile de urgență din întreaga țară. Serviciul național de pompieri a răspuns la aproximativ 3.000 de apeluri, în timp ce vânturile puternic…","The storm that wreaked havoc in Romania also caused massive damage in Poland. The balance sheet of Warsaw after the violent weather events. Record-breaking temperatures in Poland gave way to violent storms on Wednesday, straining emergency services across the country. The National Fire Service responded to around 3,000 calls as strong winds…","Tempestas, quae in Romania stragem intulit, etiam in Polonia magnum detrimentum attulit. Statera scheda Varsaviae post violentas tempestates gestas. Temperatura in Polonia record-fractionis vehementibus procellis quarta feria cessit, officia subitis per patriam nitens. Nationalis Service Ignis circa 3,000 vocat quasi ventos fortes responderit…",https://www.digi24.ro/stiri/externe/mapamond/furtuna-care-a-facut-ravagii-in-romania-a-provocat-pagube-masive-si-in-polonia-bilantul-varsoviei-dupa-evenimentele-meteo-violente-3844561,https://s.iw.ro/gateway/g/ZmlsZVNvdXJjZT1odHRwJTNBJTJGJTJG/c3RvcmFnZTA4dHJhbnNjb2Rlci5yY3Mt/cmRzLnJvJTJGc3RvcmFnZSUyRjIwMjYl/MkYwNyUyRjAyJTJGMjgxODYzN18yODE4/NjM3X3Byb2ZpbWVkaWEtMTExMjg3Mzgx/OC5qcGcmdz0xMjAwJmg9NjMwJnpjPTEm/aGFzaD1kOTExOGNkMDlhYzE5Nzk5OWFlNjc5NzM5MzUzMGRjYg==.thumb.jpg,,"Temperaturile record înregistrate în Polonia au fcut loc unor furtuni violente miercuri, punând la grea încercare serviciile de urgen din întreaga ar. Serviciul naional de pompieri a rspuns la aproxi… [+2271 chars]",,2026-07-14 07:27:39+00:00,random,,,
383cbe90b330e4b3e62fa0dc9f6fa151,2026-07-01T05:08:31Z,Storm,furtuna,www.mediafax.ro,ro,0.9,"Ciucus Reaktion nach dem verheerenden Sturm in Bukarest: „Man kann Bukarest nicht mit einem Regenschirm überziehen.“ Der Bürgermeister spricht von einer beispiellosen Situation. Der Generalbürgermeister der Hauptstadt, Ciprian Ciucu, behauptet, dass der Sturm in Bukarest eine „beispiellose Situation“ mit Eingriffen in mehr als 1.000 Gebäude geschaffen habe. Der Bürgermeister gibt an, dass die Behörden mobilisiert seien, betont aber, dass keine Stadt vorbeugen könne...","Reacția lui Ciucu, după furtuna devastatoare din București: „Nu poți pune o umbrelă peste București”. Primarul vorbește despre o situație fără precedent","Primarul general al Capitalei, Ciprian Ciucu, susține că furtuna care a lovit Bucureștiul a creat o „situație fără precedent”, cu intervenții la peste 1.000 de imobile. Edilul afirmă că autoritățile sunt mobilizate, însă subliniază că niciun oraș nu poate pre…","Ciucu's reaction, after the devastating storm in Bucharest: ""You can't put an umbrella over Bucharest"". The mayor talks about an unprecedented situation. The general mayor of the capital, Ciprian Ciucu, claims that the storm that hit Bucharest created an ""unprecedented situation"", with interventions in more than 1,000 buildings. The mayor states that the authorities are mobilized, but emphasizes that no city can pre...","Ciucu motus, post vastitatem in Bucharest tempestate: ""umbellam super Bucharest ponere non potes"". Maior de novo situ loquitur. Praefectus urbis Ciprian Ciucu asserit tempestatem in qua Bucharest percussionem ""situm inauditum"" creavit, cum interpellationibus plus quam mille aedificia. Maior civitates auctoritates conscribuntur, sed inculcat quod nulla civitas praecellere potest...",https://www.mediafax.ro/social/reactia-lui-ciucu-dupa-furtuna-devastatoare-din-bucuresti-nu-poti-pune-o-umbrela-peste-bucuresti-primarul-vorbeste-despre-o-situatie-fara-precedent-23764507,https://www.mediafax.ro/wp-content/uploads/2026/07/whatsapp-image-2026-07-01-at-07-29-59.jpeg,,"În urma furtunii puternice care a afectat Capitala, primarul general Ciprian Ciucu a declarat c a discutat înc de diminea cu reprezentanii ISU i ai Poliiei Locale, iar informaiile primite indic amplo… [+1661 chars]",,2026-07-14 07:27:39+00:00,random,,,
8dd01ab30a8fbb265bb8ac51b5e8c7b4,2026-07-02T03:10:02Z,Storm,furtuna,www.mediafax.ro,ro,0.9,"Der vom Sturm überflutete U-Bahnhof bleibt geschlossen. Verkehr auf Highway 1, neu geordnet. Die U-Bahn-Station Piața Victoriei 2 in Bukarest bleibt am Donnerstag vorübergehend für den Verkehr gesperrt, nachdem der Sturm am Dienstag das Gebiet überschwemmt und zur Ansammlung großer Wassermengen geführt hatte.","Stația de metrou inundată în urma furtunii rămâne închisă. Circulația pe Magistrala 1, reorganizată","Stația de metrou Piața Victoriei 2 din București rămâne joi temporar închisă circulației, după ce furtuna de marți a inundat zona și a dus la acumularea unor cantități mari de apă.","The storm-flooded subway station remains closed. Traffic on Highway 1, reorganized. The Piața Victoriei 2 subway station in Bucharest remains temporarily closed to traffic on Thursday, after Tuesday's storm flooded the area and led to the accumulation of large amounts of water.","Procella inundata stationem subway clausa manet. Negotiationis in via 1, reorganizata est. The Piața Victoriei 2 stationem subway in Bucharest tempus clausit ad mercaturam die Iovis, postquam tempestas Martis aream inundavit et ad cumulum aquae magnae ducitur.",https://www.mediafax.ro/?p=23765174,https://www.mediafax.ro/wp-content/uploads/2025/03/logo-mediafax.png,,"Metrorex a transmis c trenurile circul între staiile Dristor 2 i tefan cel Mare, cu îmbarcarea i debarcarea cltorilor în staia tefan cel Mare, la linia 2.
De asemenea, circulaia este asigurat între … [+594 chars]",,2026-07-14 07:27:39+00:00,random,,,
b1a6d308420f605c5d4227a49fa752ba,2026-07-02T03:46:02Z,Storm,furtuna,www.mediafax.ro,ro,0.9,"UPDATE: Der U-Bahn-Verkehr im überfluteten Bahnhof nach dem Sturm ist unter normalen Bedingungen wieder aufgenommen worden. Die U-Bahn-Station Piața Victoriei 2 in Bukarest bleibt am Donnerstag vorübergehend für den Verkehr gesperrt, nachdem der Sturm am Dienstag das Gebiet überschwemmt und zur Ansammlung großer Wassermengen geführt hatte.",UPDATE: Circulația metroului în stația inundată în urma furtunii a fost reluată în condiții normale,"Stația de metrou Piața Victoriei 2 din București rămâne joi temporar închisă circulației, după ce furtuna de marți a inundat zona și a dus la acumularea unor cantități mari de apă.","UPDATE: Subway traffic in the flooded station following the storm has resumed under normal conditions. The Piața Victoriei 2 subway station in Bucharest remains temporarily closed to traffic on Thursday, after Tuesday's storm flooded the area and led to the accumulation of large amounts of water.","UPDATE: Subway negotiatio in statione inundata quae secuta est tempestas sub normalibus conditionibus resumpsit. The Piața Victoriei 2 stationem subway in Bucharest tempus clausit ad mercaturam die Iovis, postquam tempestas Martis aream inundavit et ad cumulum aquae magnae ducitur.",https://www.mediafax.ro/social/update-circulatia-metroului-in-statia-inundata-in-urma-furtunii-a-fost-reluata-in-conditii-normale-23765174,https://www.mediafax.ro/wp-content/uploads/2026/07/734756353_1378976380774716_2365405756424078443_n.jpg,,"UPDATE
Metrorex a anunat c circulaia trenurilor de metrou pe Magistrala 1 a fost reluat în condiii normale, inclusiv în staia Piaa Victoriei 1 începând cu ora 6.30.
În urm cu scurt timp s-a încheia… [+1021 chars]",,2026-07-14 07:27:39+00:00,random,,,
2b2331e994a8f7038a3cb0b75fa5c69e,2026-07-06T06:45:24Z,Cold Wave,anul cel mai rece,www.mediafax.ro,ro,0.8,"Der Winter 2026–2027 könnte Rumänien eine Überraschung bereiten. Europa, gefangen zwischen „Super El Niño“ und der atlantischen Kälte. Die ersten Vorhersagen für den Winter 2026–2027 deuten auf eine ungewöhnliche Klimakonstellation hin: eine El-Niño-Episode, die zu einer der stärksten seit 1950 werden könnte, und ein ausgedehntes Kaltwassergebiet im Nordatlantik.","Iarna 2026–2027 ar putea veni cu o surpriză în România. Europa, prinsă între „Super El Niño” și pata rece din Atlantic",Primele prognoze pentru iarna 2026–2027 indică o configurație climatică neobișnuită: un episod El Niño care ar putea deveni unul dintre cele mai puternice observate după 1950 și o zonă extinsă de apă rece în nordul Oceanului Atlantic.,"The winter of 2026–2027 could bring a surprise to Romania. Europe, caught between ""Super El Niño"" and the Atlantic cold patch. The first forecasts for the winter of 2026–2027 point to an unusual climate configuration: an El Niño episode that could become one of the strongest seen since 1950 and an extended area of ​​cold water in the North Atlantic Ocean.","Hiems 2026-2027 Romaniam ignotam facere potuit. Europa inter ""Super El Niño"" et Oceanum frigidissimum. Primae praenuntiationes hiemali anni 2026-2027 designant ad insolitam conformationem climatis: eventus El Niño qui fieri potuit unus ex fortissimis visis ab anno 1950 et area extensa aquae frigidae in Oceano Atlantico Septentrionali.",https://www.mediafax.ro/meteo/iarna-2026-2027-ar-putea-veni-cu-o-surpriza-in-romania-europa-prinsa-intre-super-el-nino-si-pata-rece-din-atlantic-23767369,https://www.mediafax.ro/wp-content/uploads/2026/02/8110082-mediafax_foto-mihai_pop_gnm-scaled.jpg,,"Pentru Europa i România, modelele sugereaz deocamdat o probabilitate mai mare a unei ierni cu temperaturi peste normal, mai ales în a doua parte a sezonului. Episoadele de ger, ninsorile abundente i … [+4875 chars]",,2026-07-14 16:48:14+00:00,random,,,
61f9eef5b72e337b2c6fb3919034e803,2026-07-10T04:00:43Z,Snow&Ice,ger,www.digi24.ro,ro,0.9,"Meteorologen erwarten einen harten Winter in Europa. Die drei Hauptphänomene, die Frostwellen und starken Schneefall verursachen können. Europa könnte ein harter Winter mit Frostwellen und starkem Schneefall bevorstehen, wie die ersten Vorhersagen von Severe Weather Europe zeigen. Langfristige Schätzungen zeigen einen geschwächten Polarwirbel aufgrund von El Niño, stratosphärischen Windmustern und der Menge an …",Meteorologii se așteaptă la o iarnă grea în Europa. Cele trei fenomene-cheie care pot aduce valuri de ger și ninsori puternice,"Europa ar putea avea o iarnă grea, cu valuri de ger și ninsori abundente, arată primele prognoze ale Severe Weather Europe. Estimările pe termen lung arată un vortex polar slăbit, din cauza fenomenului El Nino, al tiparelor vântului din stratosferă și cantită…","Meteorologists expect a tough winter in Europe. The three key phenomena that can bring frost waves and heavy snow. Europe could be in for a tough winter, with waves of frost and heavy snow, the first forecasts from Severe Weather Europe show. Long-term estimates show a weakened polar vortex due to El Nino, stratospheric wind patterns and the amount of…","Astrologi in Europa hiemem lentam exspectant. Tria phaenomena clavis quae pruinas undas et nives graves possunt efficere. Europam in hieme lenta esse potuit, cum fluctus frigoris et nivis gravis, primum praenuntiationes ab Gravi tempestatibus Europae ostendunt. Longum tempus aestimationes dissolutae polaris vortice ex El Nino monstrant, venti stratospherici exemplaria et moles…",https://www.digi24.ro/meteo/meteorologii-se-asteapta-la-o-iarna-grea-in-europa-cele-trei-elemente-cheie-care-pot-aduce-valuri-de-ger-si-ninsori-puternice-3854833,https://s.iw.ro/gateway/g/ZmlsZVNvdXJjZT1odHRwJTNBJTJGJTJG/c3RvcmFnZTA4dHJhbnNjb2Rlci5yY3Mt/cmRzLnJvJTJGc3RvcmFnZSUyRjIwMjYl/MkYwMiUyRjE4JTJGMjU5NjQ0OF8yNTk2/NDQ4X0lOU1RBTlRfWkFQQURBX0JVQ1VS/RVNUSV8wMF9JTlFVQU1fUGhvdG9zX09j/dGF2X0dhbmVhLmpwZyZ3PTEyMDAmaD02/MzAmemM9MSZoYXNoPTRkYzYwYTM1MWUwODkyMmJiYjJkNjg0MmQ0YzVmNzY5.thumb.jpg,,"Europa ar putea avea o iarn grea, cu valuri de ger i ninsori abundente, arat primele prognoze ale Severe Weather Europe. Estimrile pe termen lung arat un vortex polar slbit, din cauza fenomenului El … [+5984 chars]",,2026-07-14 16:48:14+00:00,random,,,
f322bdbed5590573ee1c0b0c435e5adb,2026-07-02T14:35:21Z,Heat Wave,căldură record,www.mediafax.ro,ro,0.9,Ozeane erreichen Rekordtemperaturen. Was das für Hitzewellen in Europa bedeutet. Nach Angaben der europäischen Copernicus-Dienste hat die durchschnittliche Meeresoberflächentemperatur für diese Jahreszeit einen neuen Rekord erreicht und die in den Jahren 2023 und 2024 gemessenen Werte übertroffen.,Oceanele ating temperaturi record. Ce înseamnă acest lucru pentru valurile de căldură din Europa,"Temperatura medie a suprafeței oceanelor a atins un nou record pentru această perioadă a anului, depășind valorile înregistrate în 2023 și 2024, potrivit serviciilor europene Copernicus.","Oceans reach record temperatures. What this means for heat waves in Europe. The average ocean surface temperature has reached a new record for this time of year, surpassing the values ​​recorded in 2023 and 2024, according to the European Copernicus services.","Oceani recordum attingunt calores. Quid hoc sit per aestus in Europa. Mediocris superficies Oceani temperantiae novum testimonium hoc tempore anni pervenit, superans bona quae anno 2023 et 2024 scripta sunt, secundum officia Copernici Europaei.",https://www.mediafax.ro/externe/oceanele-ating-temperaturi-record-ce-inseamna-acest-lucru-pentru-valurile-de-caldura-din-europa-23765668,https://www.mediafax.ro/wp-content/uploads/2026/07/temperatura-oceanelor-copernicurs.jpg,,"Specialitii avertizeaz c înclzirea apelor poate amplifica fenomenele meteorologice extreme i afecta ecosistemele marine.
Un nou record al temperaturii oceanelor
Datele furnizate de Serviciul Copern… [+2433 chars]",,2026-07-14 21:33:16+00:00,random,,,
13cbdd6722cc4f3a53902833defdad7a,2026-07-03T07:54:15Z,Heat Wave,căldură,adevarul.ro,ro,0.9,"Europa erwärmt sich doppelt so schnell wie der Rest der Welt: Wie sich die Sommer nachhaltig verändern. Die Hitzewellen, die diesen Sommer Europa heimsuchen, seien keine Ausnahme mehr, könnten aber zu einem regelmäßigen Merkmal des Klimas auf dem Kontinent werden, warnen Wissenschaftler.",Europa se încălzește de două ori mai repede decât restul lumii: cum se schimbă definitiv verile,"Valurile de căldură care au lovit Europa în această vară nu mai sunt excepții, ci ar putea deveni o caracteristică obișnuită a climatului continentului, avertizează oamenii de știință.","Europe is warming twice as fast as the rest of the world: how summers are changing for good. The heat waves that hit Europe this summer are no longer exceptional, but could become a regular feature of the continent's climate, scientists warn.","Europa duplo velocius calefacit quam reliqui mundi: quomodo aestates in bonum mutantur. Fluctus aestus, qui Europam hac aestate feriunt, non iam eximiae sunt, sed regulariter notam climatis continentis fieri posse, viri docti monent.",https://adevarul.ro/stiri-externe/europa/europa-se-incalzeste-de-doua-ori-mai-repede-decat-2540725.html,https://cdn.adh.reperio.news/image-9/95acf302-ca3f-4f1e-87d0-6b2c4c5adc09/index.jpeg?p=f%3Djpeg%26w%3D1200%26h%3D630%26r%3Dcover,,"Valurile de cldur care au lovit Europa în aceast var nu mai sunt excepii, ci ar putea deveni o caracteristic obinuit a climatului continentului, avertizeaz oamenii de tiin. Organizaia Mondial a Sntii… [+3534 chars]",,2026-07-14 21:33:16+00:00,random,,,
48fffa582748479fc4d01e1b3b35f086,2026-07-04T04:00:57Z,Heat Wave,val de căldură,www.digi24.ro,ro,0.9,"OECD-Bericht: Extremes Wetter und Konflikte verändern Feiertage. Wie sich der Tourismus im Jahr 2026 verändert. Der Urlaub wird in den kommenden Jahren angesichts von Hitzewellen, Konflikten und sich ändernden Reisepräferenzen anders aussehen. Ein OECD-Bericht zeigt, dass sich Touristendestinationen durch die Einführung von Sicherheitsmaßnahmen auf neue Herausforderungen vorbereiten …",Raport OCDE: Fenomenele meteo extreme și conflictele schimbă vacanțele. Cum se transformă turismul în 2026,"Vacanțele vor arăta diferit în următorii ani, pe fondul valurilor de căldură, al conflictelor și al schimbării preferințelor de călătorie. Un raport al OCDE arată că destinațiile turistice se pregătesc pentru noi provocări prin introducerea unor măsuri de sig…","OECD report: Extreme weather and conflict are changing holidays. How tourism is transforming in 2026. Vacations will look different in the coming years amid heat waves, conflict and changing travel preferences. An OECD report shows that tourist destinations are preparing for new challenges by introducing security measures…","OECD report: Extremae tempestatis conflictusque feriae mutantur. Quam voluptuaria similesve in 2026. Mutationes varias spectabunt in annis venientibus inter fluctus aestus, conflictum et mutationes peregrinationes optiones. An OECD fama ostendit VIATOR destinations novas provocationes parant, securitatem mensuras inducendo…",https://www.digi24.ro/stiri/externe/mapamond/raport-ocde-fenomenele-meteo-extreme-si-conflictele-schimba-vacantele-cum-se-transforma-turismul-in-2026-3847321,https://s.iw.ro/gateway/g/ZmlsZVNvdXJjZT1odHRwJTNBJTJGJTJG/c3RvcmFnZTA4dHJhbnNjb2Rlci5yY3Mt/cmRzLnJvJTJGc3RvcmFnZSUyRjIwMjYl/MkYwNyUyRjAzJTJGMjgzMjM1OV8yODMy/MzU5X3R1cmlzdGktbGEtUm9tYS5qcGcm/dz0xMjAwJmg9NjMwJnpjPTEmaGFzaD02/NjU3ZTg5Nzk0NTYwNGM5YjZiNThjMjEzZTAxZTg0ZQ==.thumb.jpg,,"Vacanele vor arta diferit în urmtorii ani, pe fondul valurilor de cldur, al conflictelor i al schimbrii preferinelor de cltorie. Un raport al OCDE arat c destinaiile turistice se pregtesc pentru noi … [+5247 chars]",,2026-07-14 21:33:16+00:00,random,,,
